{
  "id": "hebel-flaschenzug",
  "title": "Hebel & Flaschenzug",
  "version": 2,
  "level": 1,
  "icon": "⚖",
  "durationMin": 45,
  "difficulty": 1,
  "buildResult": "Ein fertig ausgelegter Mini-Flaschenzug mit vier tragenden Strängen — samt Bauanleitung für Schnur, Karabiner und Haken.",
  "challenge": "Hebe eine Last von 2 kg (G = 19,62 N) mit höchstens 8 N Zugkraft — und erkläre, woher der Kraft-Rabatt kommt.",
  "conceptsIntroduced": ["kraft", "hebelarm", "drehmoment", "gleichgewicht", "rolle_fest_lose", "kraftuebersetzung", "wirkungsgrad"],
  "steps": [
    {
      "id": "was-ist-kraft",
      "requires": [],
      "title": "Was ist eine Kraft?",
      "goal": "Ein Gefühl dafür bekommen, was eine Kraft ist und warum ihr Angriffspunkt zählt.",
      "kind": "lernen",
      "canvas": 2,
      "estMinutes": 5,
      "blocks": [
        {
          "type": "text",
          "variant": "hook",
          "layers": {
            "intuitive": "Du drückst die Tür am Griff auf, nie am Scharnier — warum eigentlich? Gleiche Tür, gleicher Schwung, aber nah an der Angel fühlst du dich plötzlich schwach."
          }
        },
        {
          "type": "text",
          "introduces": ["kraft"],
          "layers": {
            "intuitive": "Eine Kraft ist ein gerichteter Schubs: Sie hat einen Betrag (wie fest), eine Richtung (wohin) — und einen Angriffspunkt (wo). Und genau der Angriffspunkt ist der heimliche Star. Dieselben 40 Newton wirken am Türgriff wie ein Türöffner und am Scharnier wie ein müdes Anklopfen.",
            "practical": "Kräfte misst du in Newton (N); als Faustregel wiegt eine Tafel Schokolade etwa 1 N. Für alles, was sich drehen kann, zählt neben Betrag und Richtung vor allem, wo die Kraft angreift: Je weiter weg von der Drehachse, desto mehr richtet sie aus.",
            "rigorous": "Eine Kraft ist eine vektorielle Größe (Betrag, Richtung, Angriffspunkt), Einheit Newton: 1 N = 1 kg·m/s². Bei drehbar gelagerten Körpern bestimmt die Lage der Wirkungslinie zur Drehachse die Drehwirkung — das formalisiert der nächste Schritt als Drehmoment M = F·r."
          }
        },
        {
          "type": "interactive",
          "componentId": "lever-slider",
          "params": { "formulaId": "torque_lever", "force": 100, "arm": 0.5, "forceRange": [0, 500], "armRange": [0, 2] },
          "caption": "Spiel einfach: Schiebe Kraft und Abstand — und schau, wann der Hebel kippt."
        },
        {
          "type": "task",
          "kind": "estimate",
          "question": "Am Türgriff, 80 cm von der Angel, reichen 40 N. Wie viel Kraft brauchst du direkt neben dem Scharnier, nur 10 cm von der Angel — dein Bauchgefühl?",
          "concepts": ["kraft"],
          "source": { "formulaId": "torque_balance", "inputs": { "F1": 40, "r1": 0.8, "r2": 0.1 } },
          "scale": { "min": 40, "max": 2000, "log": true, "bands": [2, 5] },
          "hint": "Der Abstand schrumpft von 80 cm auf 10 cm — auf ein Achtel. Die Kraft muss das ausgleichen.",
          "explanation": "Achtmal näher an der Angel heißt achtmal mehr Kraft: 320 N statt 40 N. Darum öffnet niemand Türen am Scharnier — der Angriffspunkt entscheidet."
        }
      ]
    },
    {
      "id": "hebelarm-drehmoment",
      "requires": ["was-ist-kraft"],
      "title": "Hebelarm & Drehmoment",
      "goal": "Die Drehwirkung einer Kraft mit M = F·r berechnen und gezielt einstellen.",
      "kind": "lernen",
      "canvas": 2,
      "estMinutes": 7,
      "blocks": [
        {
          "type": "text",
          "introduces": ["hebelarm", "drehmoment"],
          "uses": ["kraft"],
          "layers": {
            "intuitive": "Jetzt bekommt dein Türgefühl Namen: Der Abstand zur Drehachse heißt Hebelarm, und Kraft mal Hebelarm ergibt das Drehmoment — die Währung fürs Drehen. Doppelter Hebelarm, doppelte Drehwirkung. Deshalb sind Schraubenschlüssel lang und Türgriffe weit weg vom Scharnier.",
            "practical": "Das Drehmoment M = F·r sagt dir, wie stark eine Kraft dreht. F in Newton, r in Metern, M in Newtonmetern (N·m). Wichtig: r ist der senkrechte Abstand der Kraft zur Drehachse. In der Werkstatt steckst du ein Rohr auf den Schlüssel, wenn die Schraube klemmt — mehr r statt mehr F.",
            "rigorous": "Das Drehmoment ist M = F·r, mit r als senkrechtem Abstand der Wirkungslinie von der Drehachse (allgemein M = r×F, hier skalar für den ebenen Fall). Einheit N·m. Greift die Kraft schräg an, zählt nur die Komponente senkrecht zum Hebel — der wirksame Hebelarm ist die Projektion."
          }
        },
        {
          "type": "formula",
          "formulaId": "torque_lever",
          "note": "Tippe auf F oder r, um zu sehen, was die Variablen bedeuten."
        },
        {
          "type": "interactive",
          "componentId": "lever-slider",
          "params": { "formulaId": "torque_lever", "force": 30, "arm": 0.3, "forceRange": [0, 100], "armRange": [0, 1] },
          "caption": "Gleiches Drehmoment, viele Wege: viel Kraft am kurzen Arm — oder wenig Kraft am langen."
        },
        {
          "type": "calc",
          "formulaId": "torque_lever",
          "inputs": { "F": 100, "r": 0.5 },
          "expected": { "value": 50, "unit": "N*m" },
          "narrative": "100 N am halben Meter Hebelarm: M = 100·0,5 = 50 N·m. Genug, um eine festgerostete Radschraube zu überreden."
        },
        {
          "type": "task",
          "kind": "target",
          "question": "Die alte Schraube braucht genau 25 N·m. Stell Kraft und Hebelarm auf der Bühne so ein, dass M = 25 N·m wird.",
          "concepts": ["drehmoment", "hebelarm"],
          "target": {
            "formulaId": "torque_lever",
            "vars": ["F", "r"],
            "goal": { "value": 25, "tolerance": 0.02 },
            "proof": {
              "pass": { "F": 50, "r": 0.5 },
              "fail": { "F": 100, "r": 0.5 }
            }
          },
          "hint": "M = F·r — bei r = 0,5 m brauchst du F = 25/0,5. Oder du machst den Arm länger und die Kraft kleiner.",
          "explanation": "Zum Beispiel F = 50 N am Hebelarm r = 0,5 m: M = 50·0,5 = 25 N·m. Auch 25 N an 1 m treffen das Ziel — es zählt nur das Produkt."
        }
      ]
    },
    {
      "id": "hebelgesetz",
      "requires": ["hebelarm-drehmoment"],
      "title": "Das Hebelgesetz",
      "goal": "Mit dem Hebelgesetz F₁·r₁ = F₂·r₂ fehlende Kräfte berechnen.",
      "kind": "lernen",
      "estMinutes": 5,
      "blocks": [
        {
          "type": "text",
          "introduces": ["gleichgewicht"],
          "uses": ["drehmoment", "hebelarm"],
          "layers": {
            "intuitive": "Eine Wippe steht still, wenn beide Seiten gleich stark drehen — das ist Gleichgewicht. Links dreht F₁ mal r₁, rechts hält F₂ mal r₂ dagegen. Sind beide Drehmomente gleich, bewegt sich nichts. Und das ist dein Werkzeug: Wer den längeren Hebelarm hat, kommt mit weniger Kraft davon.",
            "practical": "Im Gleichgewicht gilt F₁·r₁ = F₂·r₂ — das Hebelgesetz. Aufgelöst nach der gesuchten Kraft: F₂ = F₁·r₁/r₂. Merkregel: Kraft mal Kraftarm gleich Last mal Lastarm. Damit rechnest du Brecheisen, Wippen, Zangen und Schubkarren in einer Zeile durch.",
            "rigorous": "Statisches Gleichgewicht verlangt ΣF = 0 und ΣM = 0. Am zweiseitigen Hebel liefert die Momentensumme um den Drehpunkt F₁·r₁ − F₂·r₂ = 0, also F₂ = F₁·r₁/r₂. Die Auflagerkraft im Drehpunkt folgt aus ΣF = 0 — sie dreht nicht mit, weil ihr Hebelarm null ist."
          }
        },
        {
          "type": "formula",
          "formulaId": "torque_balance"
        },
        {
          "type": "calc",
          "formulaId": "torque_balance",
          "inputs": { "F1": 20, "r1": 0.3, "r2": 0.2 },
          "expected": { "value": 30, "unit": "N" },
          "narrative": "Links ziehen 20 N an 0,3 m. Rechts, am kürzeren Arm von 0,2 m, braucht es 30 N — beide Seiten drehen mit 6 N·m, nichts bewegt sich."
        },
        {
          "type": "task",
          "kind": "numeric",
          "question": "Eine Wippe: Links sitzt ein Kind mit F₁ = 300 N bei r₁ = 1,2 m. Du drückst rechts bei r₂ = 1,8 m. Wie viel Kraft brauchst du fürs Gleichgewicht?",
          "concepts": ["gleichgewicht", "hebelarm"],
          "answer": 200,
          "tolerance": 0.01,
          "unit": "N",
          "source": { "formulaId": "torque_balance", "inputs": { "F1": 300, "r1": 1.2, "r2": 1.8 } },
          "hint": "F₂ = F₁·r₁/r₂ — dein längerer Hebelarm steht im Nenner und spart dir Kraft.",
          "explanation": "F₂ = 300·1,2/1,8 = 200 N. Der längere Hebelarm erledigt ein Drittel der Arbeit für dich — Hebelgesetz in Aktion."
        }
      ]
    },
    {
      "id": "rollen-fest-lose",
      "requires": ["hebelgesetz"],
      "title": "Rollen: fest & lose",
      "goal": "Verstehen, wie Rollen die Last auf mehrere Seilstränge verteilen.",
      "kind": "lernen",
      "canvas": 2,
      "estMinutes": 6,
      "blocks": [
        {
          "type": "text",
          "introduces": ["rolle_fest_lose", "kraftuebersetzung"],
          "uses": ["kraft", "gleichgewicht"],
          "layers": {
            "intuitive": "Eine feste Rolle hängt an der Decke und lenkt dein Seil nur um — du ziehst bequem nach unten, aber die volle Last bleibt. Der Trick beginnt mit der losen Rolle: Sie hängt in der Last und wird von zwei Seilsträngen getragen. Jeder Strang übernimmt die Hälfte. Mehr Rollen, mehr Stränge, weniger Kraft — geschenkt ist das aber nicht: Du ziehst dafür entsprechend mehr Seil. Kraft gegen Weg, das ist Kraftübersetzung.",
            "practical": "Zählregel: n ist die Zahl der Seilstränge, die die Last wirklich tragen — dann gilt F = G/n. Eine feste Rolle ändert nur die Richtung (n bleibt gleich), jede lose Rolle hängt die Last an zusätzliche Stränge. Der Preis: Für einen Meter Hub ziehst du n Meter Seil. Kraft mal Weg bleibt konstant — die Goldene Regel der Mechanik.",